{
  "mode": "paper",
  "cover": true,
  "metadata": {
    "title_zh": "B版格式示例"
  },
  "abstract_zh": "本文件仅用于检验B版课程作业模板的排版，不对应具体研究项目。封面使用原红色校徽与校名，中文摘要、目录和正文分别起页，不创建英文摘要。正文展示三级标题、普通段落、图表及引用标记的格式。模板中的文字、图片与表格均为格式测试材料，不应作为研究结论或数据来源。所有页眉和页脚保持空白。",
  "keywords_zh": [
    "文档格式",
    "段落样式",
    "模板复用",
    "排版检查"
  ],
  "blocks": [
    {
      "type": "heading",
      "level": 1,
      "preface": true,
      "text": "序 言"
    },
    {
      "type": "paragraph",
      "text": "这是一段格式校准文字，用于观察正文中文字体、首行缩进和行距。段落内容不限制文档主题，也不提供研究结论。使用技能处理已有文档时，应保留原文语义和图表对象，仅调整被明确指定的格式。"
    },
    {
      "type": "heading",
      "level": 1,
      "text": "一、正文样式"
    },
    {
      "type": "heading",
      "level": 2,
      "text": "（一）标题与段落"
    },
    {
      "type": "paragraph",
      "text": "正文中文使用五号宋体，西文采用 Times New Roman。页面和段落参数通过预设样式应用，不通过缩小字号压缩页数。段落应随内容自然跨页，不把全文设置为与下段同页。"
    },
    {
      "type": "heading",
      "level": 3,
      "text": "1.行内标记"
    },
    {
      "type": "paragraph",
      "runs": [
        {
          "text": "此处演示保留原有引用标记"
        },
        {
          "text": "[1]",
          "superscript": true
        },
        {
          "text": "以及公式字符 x"
        },
        {
          "text": "2",
          "superscript": true
        },
        {
          "text": " 和 H"
        },
        {
          "text": "2",
          "subscript": true
        },
        {
          "text": "O。排版过程中不应将上标、下标或引用编号转成无关文字。"
        }
      ]
    },
    {
      "type": "heading",
      "level": 2,
      "text": "（二）图表对象"
    },
    {
      "type": "table",
      "caption": "表1 格式检查示例",
      "header": [
        "对象",
        "检查项目",
        "处理方式"
      ],
      "rows": [
        [
          "封面",
          "校徽尺寸与位置",
          "保留原图，靠左嵌入"
        ],
        [
          "正文",
          "字体与段落",
          "应用预设样式"
        ],
        [
          "页脚",
          "文字与页码域",
          "保持空白"
        ]
      ]
    },
    {
      "type": "image",
      "path": "../layout-test.png",
      "width_cm": 10.0,
      "caption": "图1 图形对象等比缩放测试",
      "alt": "三个依次排列的矩形，仅用于检测图片尺寸与图题分页。"
    },
    {
      "type": "heading",
      "level": 1,
      "text": "二、结束位置检查"
    },
    {
      "type": "paragraph",
      "text": "正文结束后，参考文献另起一页。目录中的页定位与页脚页码相互独立：本示例保留目录页定位，但不在页面底部显示数字。实际使用时，需在最终修改后更新目录，并重新检查所有页面。"
    }
  ],
  "references": [
    "格式示例条目。此处只展示参考文献的字体、编号与分页，不代表真实文献；请替换为已核实的条目。"
  ]
}
